{"$schema":"https://json-schema.org/draft/2020-12/schema","$id":"notebook-entry.schema.json","type":"object","additionalProperties":false,"required":["note_id","revision","title","created_at","updated_at","module_ids","links","prediction","observation","explanation","limitations","next_experiment","origin"],"properties":{"note_id":{"$ref":"common.schema.json#/$defs/id"},"revision":{"type":"integer","minimum":1},"title":{"type":"string","minLength":1,"maxLength":120},"created_at":{"$ref":"common.schema.json#/$defs/time"},"updated_at":{"$ref":"common.schema.json#/$defs/time"},"module_ids":{"type":"array","maxItems":8,"uniqueItems":true,"items":{"type":"string"}},"links":{"type":"object","additionalProperties":false,"properties":{"dataset_ids":{"$ref":"#/$defs/ids8"},"run_ids":{"$ref":"#/$defs/ids8"},"checkpoint_ids":{"$ref":"#/$defs/ids8"},"artifact_ids":{"type":"array","maxItems":16,"uniqueItems":true,"items":{"$ref":"common.schema.json#/$defs/id"}}}},"prediction":{"$ref":"#/$defs/text"},"observation":{"$ref":"#/$defs/text"},"explanation":{"$ref":"#/$defs/text"},"limitations":{"$ref":"#/$defs/text"},"next_experiment":{"$ref":"#/$defs/text"},"origin":{"$ref":"common.schema.json#/$defs/origin"}},"$defs":{"text":{"type":"string","maxLength":20000},"ids8":{"type":"array","maxItems":8,"uniqueItems":true,"items":{"$ref":"common.schema.json#/$defs/id"}}}}
